text,annotation_106,annotation_107,annotation_108,annotation_101
COVID-19 Hazard pay for all 1199 SEIU healthcare workers now,pro-mitigation,anti-mitigation,pro-mitigation,pro-mitigation
COVID-19 Pandemic: Reinstate Premium Pay for Essential Employees in the State of Maryland,pro-mitigation,anti-mitigation,pro-mitigation,pro-mitigation
Impeach Michigan Governor Gretchen Whitmer NOW,pro-mitigation,unclear,unclear,unclear
Grace-Graduate final year UG students owing to Covid-19,pro-mitigation,unclear,unclear,unclear
82yr Old Woman Battling Leukemia Needs Urgent Commutation of Sentence,pro-mitigation,pro-mitigation,unclear,pro-mitigation
Online classes for Universidad europea de valencia (COVID-19 Emergency),pro-mitigation,pro-mitigation,pro-mitigation,unclear
Sack Dominic Cummings!,unclear,pro-mitigation,unclear,anti-mitigation
Support excise parity for Canadian craft distilleries,unclear,anti-mitigation,unclear,pro-mitigation
Include Australia's Already Disadvantaged in the COVID-19 Stimulus Supplement,pro-mitigation,anti-mitigation,anti-mitigation,pro-mitigation
CANCEL 2021 METRIC BOARD EXAM DUE TO THE WIDE SPREAD OF COVID 19,pro-mitigation,pro-mitigation,pro-mitigation,unclear
Make DUT shut down all campuses for an appropriate amount of time should COVID-19 worsen.,pro-mitigation,anti-mitigation,pro-mitigation,pro-mitigation
SAVE FAIRLOP SAILING SCHOOL FROM CLOSURE,anti-mitigation,anti-mitigation,pro-mitigation,pro-mitigation
"Governor Kim Reynolds: Suspend Rent, Mortgage, & Utility Payments During This Crisis",pro-mitigation,anti-mitigation,pro-mitigation,pro-mitigation
Deny Mike Harris the Order of Ontario,pro-mitigation,pro-mitigation,unclear,anti-mitigation
"Governor Andy Beshear: Suspend Rent, Mortgage and Utility payments during the Corona Virus",pro-mitigation,pro-mitigation,pro-mitigation,anti-mitigation
Open Fitness Facilities Premier,unclear,anti-mitigation,anti-mitigation,unclear
"Petition for all 2020 parents to be granted $3,000 baby support grant",pro-mitigation,pro-mitigation,unclear,pro-mitigation
"Stop coronavirus - call for permanent ban on commercial wildlife breeding, markets & trade",pro-mitigation,anti-mitigation,pro-mitigation,anti-mitigation
Release COVID-19 Child Care Data in MA!,pro-mitigation,anti-mitigation,unclear,unclear
Shutdown the University of Waterloo campus temporarily due to COVID-19,pro-mitigation,pro-mitigation,pro-mitigation,unclear
Punëtorët informal duhet të përfitojnë nga paketat e ndihmës financiare COVID-19,pro-mitigation,anti-mitigation,pro-mitigation,pro-mitigation
Pay Petsmart employees Hazard pay due to COVID-19.,pro-mitigation,pro-mitigation,pro-mitigation,pro-mitigation
Hazard Pay for Fred Meyer Employees During the Outbreak of COVID-19,pro-mitigation,pro-mitigation,unclear,pro-mitigation
Allow Michigan Youth Soccer Players To Return To Play,anti-mitigation,pro-mitigation,anti-mitigation,pro-mitigation
Academic Freeze,unclear,anti-mitigation,unclear,unclear
Stop vigilante Covid-19 roadblocks,anti-mitigation,anti-mitigation,pro-mitigation,pro-mitigation
Canada Should Ban Flights from Europe due to COVID-19,pro-mitigation,pro-mitigation,pro-mitigation,anti-mitigation
Close NBPS after Spring Break due to the outbreak of COVID-19 in Broward county.,pro-mitigation,anti-mitigation,pro-mitigation,unclear
Close QASMT For 2 Weeks (COVID-19),pro-mitigation,pro-mitigation,pro-mitigation,pro-mitigation
Norwich University students to remain off-campus in response to COVID-19,pro-mitigation,anti-mitigation,pro-mitigation,unclear
COVID-19: Change to The Leaving Cert 2020,unclear,pro-mitigation,unclear,unclear
Personal Protective Equipment (PPE) and COVID-19 Health Care for NYPD Officers,pro-mitigation,pro-mitigation,pro-mitigation,unclear
Allow ski hills to operate during Ontario lockdown,anti-mitigation,pro-mitigation,anti-mitigation,anti-mitigation
Stonewall Jackson Cemetery Name To Remain The Same,unclear,pro-mitigation,unclear,unclear
Bring the AFL grand final to Perth,pro-mitigation,pro-mitigation,unclear,unclear
INTI SHOULD CANCELLING ALL PHYSICAL CLASSES TO REDUCE SPREAD OF COVID-19,pro-mitigation,pro-mitigation,pro-mitigation,pro-mitigation
COVID-19 Support for International Students,pro-mitigation,anti-mitigation,pro-mitigation,unclear
Gofundme deve eliminare i contributi x  le raccolte COVID nel mondo e donare agli ospedali,pro-mitigation,pro-mitigation,unclear,anti-mitigation
COVID vaccines for California teachers,pro-mitigation,pro-mitigation,pro-mitigation,unclear
Corona Virus Kenya: Petition to STOP all flights from CHINA & #COVID-19 hotspots,pro-mitigation,anti-mitigation,pro-mitigation,anti-mitigation
Cancel School for CPS,anti-mitigation,unclear,pro-mitigation,pro-mitigation
Provide federal financial assistance to renters affected by COVID-19,pro-mitigation,anti-mitigation,pro-mitigation,unclear
COVID-19: Suspend classes and Encourage online teaching at Coventry University,pro-mitigation,anti-mitigation,pro-mitigation,unclear
Sénégalais de l'extérieur victimes du COVID-19,unclear,unclear,pro-mitigation,unclear
Demand Congress Provide Free School Meals To Every K-12 Student In America,unclear,pro-mitigation,unclear,pro-mitigation
Lower Temple University Fall 2020 Tuition,unclear,unclear,pro-mitigation,unclear
AOTA Needs to Address Murders of Black Men and Women to Support OT's Diverse Community,unclear,pro-mitigation,unclear,pro-mitigation
Do not transfer our Municipal Commissioner until Covid is eradicated,pro-mitigation,anti-mitigation,pro-mitigation,anti-mitigation
Cover Covid19 Exposed or Contracted Longshore Workers Under Federal Compensation.,pro-mitigation,pro-mitigation,pro-mitigation,pro-mitigation
"SAY NO to using the Wyndham, Fresh Meadows to House 100 Former Inmates and Sex Offenders!",anti-mitigation,pro-mitigation,unclear,anti-mitigation
Help convince Inslee and WIAA to allow HS spring sports to resume,anti-mitigation,pro-mitigation,anti-mitigation,anti-mitigation
NZTR: Shifting the two Guineas Group One races north will ruin Cup Week in Christchurch!,anti-mitigation,pro-mitigation,unclear,anti-mitigation
#PostponeNEET_JEE,pro-mitigation,pro-mitigation,unclear,anti-mitigation
"""Play On""",anti-mitigation,pro-mitigation,unclear,unclear
NCAA Covid-19 Eligibility Relief,pro-mitigation,anti-mitigation,unclear,unclear
No to abandonment,pro-mitigation,anti-mitigation,pro-mitigation,unclear
NJ edTPA COVID-19: WAIVE edTPA for Fall 2020 Graduates,pro-mitigation,anti-mitigation,pro-mitigation,unclear
Get CoVID Vaccines to Nepal ASAP and prevent a humanitarian disaster,pro-mitigation,pro-mitigation,pro-mitigation,anti-mitigation
Compensate Essential Workers,pro-mitigation,pro-mitigation,pro-mitigation,pro-mitigation
Amend Recent COVID-19 Restrictions for Personal Care Services in London-Middlesex from,pro-mitigation,anti-mitigation,unclear,unclear
Petition against COVID-19 & Quarantine Bill: Say NO! to abuse of power and human rights.,anti-mitigation,,anti-mitigation,anti-mitigation
Shut down TORONTO COVID-19,pro-mitigation,pro-mitigation,pro-mitigation,anti-mitigation
Force Big Chain Supermarkets/Takeaways to Drop Delivery Fees During the Covid-19 Pandemic,anti-mitigation,pro-mitigation,pro-mitigation,anti-mitigation
BAN USE OF CHEMICAL CROWD-CONTROL AGENTS DURING THE COVID-19 PANDEMIC,anti-mitigation,unclear,anti-mitigation,anti-mitigation
Allow virtual HBUHSD teachers to continue instruction online,pro-mitigation,pro-mitigation,pro-mitigation,pro-mitigation
"Tell Governor Newsom to Release Patricia Wright, A Blind Grandmother with Terminal Cancer",anti-mitigation,anti-mitigation,unclear,pro-mitigation
"Demand to grant  PR Status to Work permit holders, Refugee Claimants and Int. Students.",pro-mitigation,unclear,unclear,pro-mitigation
PLEASE SHUT DOWN and CLEAN Amazon facilities that test positive for COVID-19,pro-mitigation,pro-mitigation,pro-mitigation,pro-mitigation
Please Let Massachusetts Golf,anti-mitigation,anti-mitigation,unclear,unclear
Stop Deportation- Mother faces deportation that would take her away from her daughter,unclear,anti-mitigation,unclear,anti-mitigation
"The stoppage of Justin Trudeau's ""assault weapons"" ban",unclear,anti-mitigation,unclear,unclear
Allow Businesses and small traders to resume in Mumbai.,anti-mitigation,pro-mitigation,anti-mitigation,pro-mitigation
"With The world facing a Covid-19 pandemic, Unisa exams to change from seat-in to portfolio",pro-mitigation,unclear,pro-mitigation,unclear
DSTV should give S​.​A. subscribers a payment break or decrease prices during Covid-19,pro-mitigation,anti-mitigation,pro-mitigation,pro-mitigation
Postpone VTU exams,pro-mitigation,anti-mitigation,pro-mitigation,pro-mitigation
