text,annotation_84,annotation_85,annotation_86,annotation_87
Request to reconsider DPS Ruby Park school tuition and transport fees for COVID-19,pro-mitigation,pro-mitigation,pro-mitigation,unclear
"Suspension of Rent, Mortgage, & Utility Payments During the Coronavirus Pandemic",pro-mitigation,pro-mitigation,pro-mitigation,pro-mitigation
Tamil Nadu needs to close colleges due to COVID- 19  Do You agree?,pro-mitigation,pro-mitigation,unclear,pro-mitigation
Salviamo la Repubblica dell’Arte di Frigolandia dall’assurda minaccia di sgombero,unclear,unclear,unclear,unclear
Less Schoolwork during COVID-19 Quarantine,unclear,pro-mitigation,pro-mitigation,unclear
"LET'S GET HOUSE BILL 1532 PASSED, REDUCE JAIL & PRISON POPULATIONS FROM SPREADING COVID-19",unclear,pro-mitigation,pro-mitigation,pro-mitigation
Tax free earnings for all healthcare workers during Covid-19 crisis,pro-mitigation,pro-mitigation,pro-mitigation,pro-mitigation
Cover COVID-19 treatment in #Aarogyasri Scheme,pro-mitigation,pro-mitigation,pro-mitigation,unclear
The New School: Aid Students with a Partial Tuition and Housing Refund,unclear,pro-mitigation,pro-mitigation,pro-mitigation
NO to the COVID-19 Public Health Response Bill,anti-mitigation,anti-mitigation,anti-mitigation,anti-mitigation
Crisis Pay: Give Frontline Healthcare Workers The Pay They Deserve,pro-mitigation,unclear,pro-mitigation,unclear
Extend JobKeeper for Travel  Agency Agents and Mobile Travel Agents (Sole Traders).,unclear,unclear,pro-mitigation,unclear
Lasershows statt Feuerwerke! #böllerfrei,unclear,unclear,unclear,unclear
Partial fee refund due to Universities closure in the midst of COVID-19 outbreak,pro-mitigation,pro-mitigation,pro-mitigation,pro-mitigation
Hospital visits to be permitted to critical patients who need their loved ones around them,anti-mitigation,pro-mitigation,pro-mitigation,unclear
Lorenzo (USC Off-Campus Student Housing) Rent Waived/Reduced due to COVID-19,pro-mitigation,pro-mitigation,pro-mitigation,unclear
Protect the UNT community from COVID-19 by suspending face-to-face classes and meetings.,pro-mitigation,pro-mitigation,pro-mitigation,pro-mitigation
COVID 19 Beauty Industry Economical Impact - Canada,pro-mitigation,unclear,unclear,unclear
Release Non-Violent Offenders in Prison Camps due to COVID-19,pro-mitigation,pro-mitigation,pro-mitigation,unclear
"Central University of Lucknow is conducting exams from 16th , risking the health of studen",anti-mitigation,pro-mitigation,anti-mitigation,anti-mitigation
Allow dog walking during SA lockdown,unclear,unclear,anti-mitigation,anti-mitigation
Let Wisconsin Golf,anti-mitigation,anti-mitigation,unclear,unclear
Freeze Law Society of Ontario & LAWPRO Fees due to COVID-19,pro-mitigation,pro-mitigation,unclear,pro-mitigation
Humanitarian Appeal to Release Maulana Delawar Hossain Sayedee,unclear,unclear,unclear,unclear
"Compassionate medical release for Previn Coleman, amid COVID 19 crisis in Elkton FCI Ohio",pro-mitigation,pro-mitigation,unclear,pro-mitigation
"Mandatory Medical Cover, Safety Gear and Job Security For Journalists",pro-mitigation,unclear,pro-mitigation,pro-mitigation
ALL colleges TEST OPTIONAL for Fall 2020 applications amid COVID-19 pandemic,pro-mitigation,unclear,pro-mitigation,unclear
Make Selling dogs illegal unless you are a licensed and accredited breeder,unclear,unclear,unclear,unclear
Please make masks mandatory in Georgia,pro-mitigation,pro-mitigation,pro-mitigation,pro-mitigation
Protect our children!!! Demand Covid release,pro-mitigation,pro-mitigation,pro-mitigation,pro-mitigation
Postpone 10th and 12th boards exam due to rise in Covid19 cases.,pro-mitigation,pro-mitigation,pro-mitigation,pro-mitigation
Covid-19 Economic Relief for Property Owners,pro-mitigation,pro-mitigation,pro-mitigation,pro-mitigation
Rehabilitation of those affected severely by Amphan,unclear,unclear,unclear,unclear
Open up Outdoor Dining,anti-mitigation,anti-mitigation,anti-mitigation,anti-mitigation
Open Canada VACs in India,pro-mitigation,anti-mitigation,anti-mitigation,unclear
Shut down construction sites to prevent the spread of covid 19,pro-mitigation,pro-mitigation,pro-mitigation,pro-mitigation
Stop Murrayfield Ice rink from closing it’s doors for good,anti-mitigation,unclear,anti-mitigation,pro-mitigation
Postpone UCLA's 2020 Commencement Instead of Cancelling,pro-mitigation,unclear,pro-mitigation,unclear
COVID-19 IN Georgia's Prisons Rise,unclear,pro-mitigation,unclear,unclear
Allow Parents in Botswana  to Purchase Baby & Children's Essentials for the Winter,anti-mitigation,unclear,unclear,unclear
Save South Norwood Library,unclear,unclear,unclear,unclear
COVID-19 Impact: Need waiver for Small & Medium Business owners.,pro-mitigation,pro-mitigation,pro-mitigation,pro-mitigation
Close All Educational Institutions for Teachers and Other Staff #KeepTeachersSafe,anti-mitigation,pro-mitigation,pro-mitigation,pro-mitigation
Doula Support in Nebraska Hospitals during COVID-19 Outbreaks,pro-mitigation,pro-mitigation,pro-mitigation,pro-mitigation
OUR LOVED ONES ARE DYING! Stop shielding nursing homes from liability!,anti-mitigation,unclear,unclear,anti-mitigation
Keep Davis School District students safe by keeping hybrid schedule.,pro-mitigation,pro-mitigation,pro-mitigation,pro-mitigation
Trump must resign for admitting to downplaying COVID-19,unclear,pro-mitigation,pro-mitigation,unclear
Extend education loan grace period to support the graduates struggling to find jobs #COVID,pro-mitigation,pro-mitigation,pro-mitigation,unclear
Postpone CA exams for COVID Safety Reasons #CAExams,pro-mitigation,pro-mitigation,pro-mitigation,pro-mitigation
CHANGE THE AMBULANCE SERVICE STATUS FROM ESSENTIAL TO EMERGENCY AFTER COVID-19,pro-mitigation,unclear,anti-mitigation,anti-mitigation
Improve COVID-19 Procedures In Correctional Facilities,pro-mitigation,pro-mitigation,pro-mitigation,pro-mitigation
"COVID-19 MAY GET ERADICATED, BUT NOT OUR UNIVERSITIES ATROCITY",pro-mitigation,unclear,unclear,unclear
"Keep YOUR Allied HEALTH Practitioners OPEN!  
Ease the burden OUR medical system may face.",pro-mitigation,anti-mitigation,pro-mitigation,pro-mitigation
Stop Wildlife Medicine in China,unclear,unclear,unclear,unclear
Cancel 2021 GCSE & A-Level Exams,unclear,pro-mitigation,unclear,unclear
Withdraw the freeze in hike of dearness allowance of central govt employees and pensioners,unclear,unclear,pro-mitigation,unclear
STOP THE COVID-19 VACCINATION CAMPAIGN,anti-mitigation,anti-mitigation,anti-mitigation,anti-mitigation
COVID-19,unclear,unclear,unclear,unclear
Open our Garden Centres,anti-mitigation,anti-mitigation,anti-mitigation,anti-mitigation
Requesting Free State Gov to provide list of companies who received Covid-19 Relief Fund,unclear,pro-mitigation,unclear,unclear
Declare the Road Accident Fund an Essential Service,unclear,unclear,unclear,unclear
Suffolk County Executive Steve Bellone and Dr. Pigott (Suffolk DOH): Let ALL Sports Play!,anti-mitigation,anti-mitigation,anti-mitigation,anti-mitigation
The Heritage Private School: reduce payments for educational services during COVID-19,pro-mitigation,pro-mitigation,pro-mitigation,pro-mitigation
Optional Pass/Fail for UIUC,pro-mitigation,unclear,unclear,unclear
