text,annotation_48,annotation_45,annotation_46,annotation_47
"Do the political staffers and politicians see this?   Canadians deserve transparency. When Americans were getting vaxxed, CDC quickly released new guidelines. Life is going back to normal. When will do the same?   #cdnpoli",pro-mitigation,unclear,pro-mitigation,pro-mitigation
And what are the CDC guidelines regarding vaccinated individuals needing to quarantine after potentially in contact with someone who is covid positive?,unclear,unclear,unclear,pro-mitigation
"India should reach adequacy by the end of 2021. 

Without disturbing current immunisation infrastructure, which can… https://t.co/Dz2bPbOpbZ",unclear,unclear,unclear,unclear
"Hi, We are doing our best to remain open to serve our clients while implementing changes within our financial centers to follow CDC  and government guidelines. As such, some locations may be either temporarily closed or operating at adjusted hours. ^Annette",pro-mitigation,anti-mitigation,unclear,pro-mitigation
Dr. Fauci speaks on CDC’s new guidelines for fully vaccinated students  https://t.co/4pFpslDYZU via ,unclear,unclear,unclear,pro-mitigation
A 25-year-old man from Nevada is the first known American to catch #COVID-19 twice. The patient has since recovered… https://t.co/vwiFi3dggB,unclear,unclear,unclear,unclear
Brace yourself. This is going to be the norm for while. The development of a safe and effective vacc… https://t.co/NFjXMshfUT,unclear,pro-mitigation,unclear,unclear
BREAKING: PGIMER in Chandigarh will be beginning the Phase II trial of oxford Covid-19 vaccine candidate -- Covishi… https://t.co/9dy2UyOdqM,unclear,unclear,unclear,unclear
Russia have introduced the first #CovidVaccine &amp; I guess what an amazing news 😍 I hope it works amazing as well 🤞🏻… https://t.co/zWXNBZbL4z,unclear,pro-mitigation,pro-mitigation,pro-mitigation
"To people getting the #FluShot and later #CovidVaccine: 

Thank you!

- From the people not able to be vaccinated b… https://t.co/UPMgiDaH40",pro-mitigation,unclear,unclear,pro-mitigation
Hopefully they will release information on the adverse event #clinicaltrial #CovidVaccine https://t.co/z2lXMJH6Ut,unclear,unclear,unclear,unclear
"Do we have an operation #warpspeed ? 

https://t.co/Su4efqdbzb",unclear,unclear,unclear,unclear
"""Fully vaccinated people can resume activities without wearing a mask or physically distancing, except where required by federal, state, local, tribal, or territorial laws, rules, and regulations, including local business and workplace guidance."" Latest guidelines - CDC website",unclear,anti-mitigation,unclear,pro-mitigation
"The Indian Express: Russia Covid-19 vaccine: World leaders, health officials have mixed response.… https://t.co/EuuI4zjPpe",unclear,unclear,unclear,unclear
"This is why CDC guidelines are that testing asymptomatic, vaccinated people is unnecessary. It is unlikely that they are able to spread, despite being infected. The vaccines do their job.",pro-mitigation,unclear,pro-mitigation,pro-mitigation
#NagpurAlert : 73 persons tested +ve from #Nagpur today till 11.30 pm; Total cases 10361; #COVID19… https://t.co/YmVSpoPTTN,unclear,unclear,unclear,unclear
"It is great to see that our country is getting ready for #CovidVaccine and also for world.
#AatmaNirbharBharat… https://t.co/XNErRSSaYt",unclear,pro-mitigation,pro-mitigation,pro-mitigation
"Divyansh Singh, August 14, 2020, Bangalore

Rahul Gandhi Condemns Government Over COVID-19 Vaccine. Read Full Story… https://t.co/ai5AHzYfdT",unclear,unclear,unclear,unclear
"Take a minute and lookup ""Private Conveyance"".  Then lookup the exclusions of the CDC guidelines.  Good Lord you anti maskers are uneducated.",pro-mitigation,pro-mitigation,pro-mitigation,anti-mitigation
"“The general population appears desensitized to the threat, and individuals are not following CDC guidelines related to mask-wearing for unvaccinated persons or maintaining social distancing in crowded indoor locations.”",unclear,unclear,unclear,pro-mitigation
Of course. Then please follow cdc guidelines on the unvaccinated and we will all get through this healthily.,pro-mitigation,unclear,pro-mitigation,pro-mitigation
"Everyone's life is important. Just because some people have money/can afford to be home till a #CovidVaccine comes,… https://t.co/UoYtEkjvd9",unclear,pro-mitigation,unclear,anti-mitigation
"Of course they bear *some* responsibility, as is true of nearly anyone infected. None of us take maximal precautions all the time. They were, however, following CDC guidelines for the fully vaccinated. The ""problem"" is that they got infected. We keep learning.",anti-mitigation,pro-mitigation,anti-mitigation,anti-mitigation
I meandered onto some trolls timeline and saw a Bre*tbart personality urging red state legislators to write laws override CDC guidelines. Just like an active effort to doom people.,pro-mitigation,unclear,anti-mitigation,unclear
To those who wear a mask- thank you. Thank you for thinking of others. Thank you for caring about everyone else besides yourselves only. Same thing to those who got vaccinated &amp; wear masks / wore them &amp; follow cdc guidelines ❣️,unclear,pro-mitigation,pro-mitigation,pro-mitigation
A federal appeals court panel sided with the CDC in its legal battle with Florida over COVID-19 guidelines for cruise lines.    https://t.co/iMtefYHQis,unclear,pro-mitigation,unclear,unclear
please help us spread the word #covidwarriors #MythAndFact #COVID19India #CovidVaccine… https://t.co/451g1JYAOh,unclear,unclear,unclear,pro-mitigation
"Is the Russian vaccine good?

It’s tested on 76 volunteers; phase 3 trials not done. A good vaccine is tested on 20… https://t.co/9BSK5zeDmp",unclear,unclear,unclear,anti-mitigation
"Bill Gates Vaccine Record 

https://t.co/AWiuCmAqNR via 

#ExposeBillGatesDay #BillGates… https://t.co/3axeEYcmPb",unclear,unclear,unclear,unclear
did cdc and federal guidelines train or are you not enforcing masks on public transit. I’m wearing a mask and 80% of other ladies aren’t. Wellington station. T ambassador not telling folks to mask up. #shame #WearAMask,unclear,pro-mitigation,anti-mitigation,pro-mitigation
Scientists at Oxford University have made a breakthrough in the quest to find a COVID-19 vaccine. Vital preparation… https://t.co/ciJ0BP1puh,unclear,pro-mitigation,unclear,pro-mitigation
Totally safe all produced &amp; provided by #mypillowguy very trustworthy believe you me LMAO #LiesLiesLies… https://t.co/YGYdeikEPY,unclear,unclear,unclear,unclear
"Fight against Corona: COVID-19 vaccine maybe ready by the end of 2020, said experts https://t.co/utYNpWsxR2… https://t.co/yUXDsiCXlq",unclear,pro-mitigation,unclear,pro-mitigation
Sirf  #MukeshAmbani  Company &amp; it's Workers Jobs are Safe baaki Sa… https://t.co/GW2KpWZpNz,unclear,unclear,unclear,unclear
Welk this is concerning. #CovidVaccine https://t.co/AMuR0zHv3Q,unclear,unclear,unclear,unclear
"Doctor warns the #Italian people on #COVIDvaccine #COVID19 

https://t.co/o1QQgKGrDB",unclear,unclear,unclear,unclear
"People who are fully vaccinated can travel within the U.S., according to updated CDC guidelines announced on Friday.  https://t.co/gcSa5MhcS2 03",pro-mitigation,unclear,unclear,pro-mitigation
"#azaadi from masks. When is this happening? 
#COVID19 #CovidVaccine https://t.co/mtioeYNRdS",unclear,unclear,anti-mitigation,unclear
California schools will still require masks despite CDC guidelines  https://t.co/jBPpz1DjxB,unclear,pro-mitigation,unclear,anti-mitigation
"Johnson &amp; Johnson's coronavirus vaccine is fourth to begin Phase 3 trials in the United States #CovidVaccine
https://t.co/26x8epwVed",unclear,unclear,unclear,unclear
Friday’s Articles On School Reopening – New CDC Guidelines Edition!  https://t.co/fSQuQwxz6r,unclear,unclear,unclear,pro-mitigation
China National Biotech Group has two vaccine candidates out of five from Chinese developers that are in the final s… https://t.co/gJvxMew7fz,unclear,unclear,unclear,unclear
"I admit, the dropping of masks from CDC guidelines &amp; ensuing dropping of masks in stores are what finally convinced me to get vaccinated. TX was one of the first to drop the mandate, but people still masked in urban areas. But yes, it's backfiring horribly",unclear,unclear,anti-mitigation,pro-mitigation
"#Russia and #Iran To Jointly Produce #Coronavirus Vaccine

#CovidVaccine 

https://t.co/Xj33dRVBCK",unclear,unclear,unclear,unclear
"Federal judge rules in favor of Florida, tosses out CDC cruise guidelines  https://t.co/vJjpvqQ7Vs",unclear,pro-mitigation,unclear,unclear
It will probably be compulsory here too. Why else would Trump say the military is going to distribute the vaccine i… https://t.co/pAz9w3RsuF,unclear,unclear,unclear,unclear
"As someone who grew up in Upland and Alta Loma, fuck you. This is not only morally bankrupt, it’s against CDC guidelines.",pro-mitigation,unclear,pro-mitigation,pro-mitigation
The has published updated requirements for Emergency Use Authorization (EUA) for #coronavirus therapeutics.… https://t.co/2gt87CoBoj,unclear,unclear,unclear,pro-mitigation
"Uttar Pradesh registers record 95 COVID-19 deaths, toll rises to 2,733; 4,991 fresh cases push state's infection co… https://t.co/IzcEzfsVDv",unclear,unclear,unclear,unclear
"WHO., CDC different guidelines. CDC , Dr Fauci not yet changed it's same fully vaccinated don't need to wear mask outdoors and indoor settings.",unclear,unclear,anti-mitigation,pro-mitigation
