text,annotation_48,annotation_45,annotation_46,annotation_47
Putin ahead of the curve. #CovidVaccine https://t.co/eJedkgM04X,unclear,unclear,unclear,unclear
"No #compromise on quality of #COVIDvaccine: CMD

https://t.co/5sLg8aDgqz",unclear,unclear,anti-mitigation,pro-mitigation
This goes against CDC guidelines. Vaccinated people don't need to wear masks. Why is LA county anti-science?,pro-mitigation,anti-mitigation,pro-mitigation,pro-mitigation
"#Twitter ;

#sputnik 
Russia state-affiliated #CovidVaccine",unclear,unclear,unclear,unclear
"New CDC school guidelines: No masks required for vaccinated students, teachers  https://t.co/K3fagsv2xL",unclear,unclear,unclear,pro-mitigation
So true...just like analysis a few months ago: mandatory #Covid_19 #facemasks is the entry point int… https://t.co/V9oSgYbpYY,unclear,unclear,unclear,unclear
"The people who developed the CDC guidelines, unlike Nate, have public health and epidemiology degrees and they are world-class experts. You are defending a troll who suffers from Dunning Kruger syndrome. He should just stop.",pro-mitigation,unclear,pro-mitigation,pro-mitigation
"No Known Data on Quality, Efficacy and Safety of #Russian #COVIDVaccine: Germany.

https://t.co/RoMkvbgKMO",unclear,unclear,unclear,anti-mitigation
"After a thorough review, and in accordance with CDC guidelines, customers who are fully vaccinated are no longer required to wear masks while visiting our stores unless mandated by state or local regulations.",unclear,anti-mitigation,unclear,pro-mitigation
"Sadly, I think the only way to protect ourselves from these selfish assholes is to continue to mask and keep to the CDC guidelines we were following last winter.",anti-mitigation,unclear,pro-mitigation,pro-mitigation
.. and then there are talks on using #Aadhar 'like' model for the roll out of #CovidVaccine (… https://t.co/obRWfNFvju,unclear,unclear,unclear,unclear
"I'm not crazy. I don't like crazy people. I follow the CDC guidelines of ""wearing a mask"" for those that are not vaccinated, such as myself. That doesn't mean I don't care about my life. After several tests (including recently), I have tested ""negative"" for any #COVID19 symptoms.",pro-mitigation,pro-mitigation,pro-mitigation,pro-mitigation
"Go home, you're drunk.

I generally advocate on #CNN's behalf, but c'mon y'all.
#TigerKing #CovidVaccine https://t.co/aYtDpGwIVB",unclear,unclear,unclear,unclear
"WHO in contact with Russia on world's first COVID-19 vaccine 

#COVID19 #COVID #RussianVaccine #CovidVaccine 
https://t.co/OBy016eTlS",unclear,unclear,unclear,unclear
"Dr. Francis Collins, Director of the NIH, in testimony on the search for a #covidvaccine - ""Science is the way this… https://t.co/1e36QPOTS8",unclear,unclear,unclear,unclear
#cdcowgChat “I have a conflict. I receive funding to conduct reviews of opioids. I’ll be recusing myself after the director’s update.” #RogerChou #COIs #CDCGuidelines,unclear,unclear,unclear,anti-mitigation
people taking that COVID19 vaccine and then 6 months later the BLM protests gonna look… https://t.co/V5efzri22C,unclear,unclear,unclear,unclear
"Well done Russia and Mr Putin , you are hope of millions of lives that could saved from now till th… https://t.co/d6j19tEec4",unclear,pro-mitigation,pro-mitigation,pro-mitigation
"A watershed moment in vaccine manufacture ?!- insightful commentary from 
#CovidVaccine #Covid_19 https://t.co/QIJaEltJsT",unclear,unclear,unclear,unclear
"Or he's not vaccinated and following CDC guidelines, as he should.   But you don't have to wear one because you got the jab. 👍",pro-mitigation,unclear,unclear,pro-mitigation
Read up on the CDC website for guidelines and recommendations. I think you’re ok to go.,pro-mitigation,unclear,pro-mitigation,pro-mitigation
"Vaccines can't be given to youngsters unless they've been tested in their age group.

#Covid19 #CovidVaccine… https://t.co/7VFzSoVBW6",anti-mitigation,unclear,anti-mitigation,anti-mitigation
Not everybody will have the same chance to be immunised. A recent report says that wealthy nations representing jus… https://t.co/tu5eA0VUk5,unclear,pro-mitigation,unclear,unclear
"Federal Judge Rules Against CDC, Throws Out Cruise Guidelines In FL   https://t.co/xgMLeuSCDS",unclear,unclear,pro-mitigation,anti-mitigation
We're revisiting #biotech company Pharmaceuticals that’s leading the way with a #COVID19 antibody cockta… https://t.co/U1V0BGDZyO,unclear,unclear,unclear,unclear
This article from the same source highlights some of the challenge with the cdc guidelines:  https://t.co/kxQge7mUud,unclear,unclear,unclear,anti-mitigation
Such a great example of leadership.. Didn't even bother to apply the #CovidVaccine on his daughter https://t.co/2IW34x3Jwr,unclear,anti-mitigation,anti-mitigation,pro-mitigation
Or ...you could do a simple Google search for CDC guidelines on children  and not embarrass the rest of us image bearers of God,unclear,unclear,pro-mitigation,pro-mitigation
Why is there no news articles on the protests going on in Manchester about #SaveOurChildren and the #CovidVaccine b… https://t.co/PLdabUToWz,unclear,unclear,unclear,anti-mitigation
"“This morning, for the first time in the world, a vaccine against the new coronavirus was registered in Russia,"" Ru… https://t.co/5ygMVV3Wmo",unclear,unclear,unclear,unclear
Yes! CDC shouldn’t have changed mask guidelines until EVERY age group was vaccinated.,anti-mitigation,pro-mitigation,pro-mitigation,anti-mitigation
That was  my point the CDC  guidelines are clear ban for dogs entry to the U.S . You didn't let me travel with CATS  to COLOMBIA.  So whats your point? I want my money back #jetbluesucks,unclear,unclear,unclear,unclear
"Covid Items Bechne Walo ...

Stock Clear Karo Vaccine Aa Gaya ...

&amp; Save Money  Vaccine Bhi To Black me Bechna Hai… https://t.co/4J8Aws8O9y",unclear,unclear,unclear,unclear
"#covidvaccine to all those that claim genetic drift of #sarscov2 won't matter much:

In $MRNA pseudovirus neutraliz… https://t.co/eELW2l2Wq5",unclear,unclear,unclear,unclear
Trump administration has said that it will not work with an international cooperative effort to develop and distrib… https://t.co/9fYuRkflLd,unclear,unclear,unclear,unclear
And the is going to approve and administer the #CovidVaccine ?  Who’s running the show there?… https://t.co/jmxTriwJPd,unclear,unclear,unclear,unclear
Have to understand how COVID affects peeps. My B+ brother-in hospital. His O+ wife-sniffles. Nada. We have to understand this disease. It is the Catholic thing to do. I have O+ blood. Did CDC guidelines but food shop &amp; outdoor dine. I am still here. Vino helps.,unclear,unclear,unclear,anti-mitigation
Very disappointed in for not following CDC guidelines and instead following their own guidelines- thus not allowing a teen a trip of a lifetime. Sad to see what they’ve become.,pro-mitigation,unclear,anti-mitigation,pro-mitigation
"Hahahah ""I am not defending crowder""  Do you think America is the only country on earth with doctors or CDC's?  Funnily enough most nations on earth have the same guidelines that you do, why do you think that is?",unclear,unclear,unclear,pro-mitigation
What hypocrisy? She’s following the CDC guidelines for vaccinated individuals that have been in place for months (and technically you don’t need to get tested - per guidelines - if you’re asymptomatic and vaccinated).    https://t.co/6qP68plwk1,pro-mitigation,unclear,unclear,anti-mitigation
"""thief with knife, not a doctor with vaccine""!
#vaccinationdream
#coronavirus #CovidVaccine #vaccine https://t.co/tFK71O5oxe",anti-mitigation,pro-mitigation,anti-mitigation,anti-mitigation
There are plenty of people for whom this is absolutely an urgent matter.  CDC needs to treat it as such.  Hopefully more thoughtful guidelines coming soon.,pro-mitigation,unclear,pro-mitigation,pro-mitigation
Discussing CDC Guidelines.   As Superintendent he follows CDC Guidelines and Governor Directives.   The plan will be presented.  #VegasEd #Vegas #Nevada #Covid19 #Safety  https://t.co/1OASGtybyg,unclear,unclear,unclear,pro-mitigation
Indeed. Even in the dysfunctional US health system they have the National Vaccine Inju… https://t.co/kmrgSmkW0g,unclear,unclear,unclear,anti-mitigation
The CDC is leaving it up to local officials to set mask-wearing guidelines as the highly contagious delta variant spreads in areas with low vaccination rates.  https://t.co/saXfWh6dzy,unclear,pro-mitigation,unclear,unclear
"#CovidVaccine
Russia's President Vladimir Putin on Tuesday said the country has developed the ""first"" coronavirus v… https://t.co/99M6xUOuYK",unclear,pro-mitigation,unclear,unclear
CDC said it was safe. I’m fully vaccinated &amp; I follow CDC guidelines. Been doing so this whole pandemic. So no mask 🤷🏽‍♂️,pro-mitigation,unclear,unclear,pro-mitigation
"The Coronavirus Vaccine Tracker
by #COVID19 #CovidVaccine
https://t.co/vg2q7Shw3c",unclear,unclear,unclear,unclear
"Three Texas House Democratic lawmakers had been vaccinated against the coronavirus, but tested positive over the last 24 hours/  The lawmakers traveled on a private chartered flight and complied with CDC guidelines.  Fortunately there were ZERO unvaccinated people on their flight",unclear,pro-mitigation,unclear,anti-mitigation
Researchers across the US have stepped up efforts towards the development of an effective Covid-19 vaccine… https://t.co/xL4VUWIkua,unclear,pro-mitigation,unclear,unclear
COVID-19 recovered patients protected during massive outbreak on U.S vessel. How long do anti-bodies last in a COVI… https://t.co/oZ3UuFdHLi,unclear,unclear,unclear,unclear
"What's to lose - Sure Nov. 1 no problem!
#CovidVaccine 

'Great for the manufacturers': How the law shields drug ma… https://t.co/DVJ7wQBNQP",unclear,unclear,unclear,unclear
"BJP is Blackmailing voters with #CovidVaccine ,  Bihar voters should question BJP and their allies why… https://t.co/7Bu7CxslHX",unclear,unclear,unclear,unclear
"Russia is the first country to approve a vaccine!

President Putin said this RUSSIAN VACCINE works effectively but… https://t.co/YSUhxSN8UC",unclear,pro-mitigation,unclear,unclear
"Many blue governors were using the CDC guidelines as a shield to tell state residents “sorry, CDC says we gotta.” Once the CDC lifts that, all that’s left is the relentless, screaming pressure on them to lift mask mandates and reopen fully.",unclear,unclear,anti-mitigation,pro-mitigation
We shouldn't need to go digging to find these things out. Release your data #CovidVaccine https://t.co/VhsYzqoPz5,unclear,unclear,unclear,anti-mitigation
"One ethicist warns there are ""tricky decisions"" to be made about who is vaccinated first.
Some experts say a lotter… https://t.co/8RnzPHa6GP",unclear,unclear,unclear,anti-mitigation
Just when the CDC’s usefulness is called into question they give us guidelines to not cuddle with chickens.,unclear,unclear,anti-mitigation,anti-mitigation
"It’s so intrusive now.They tried to push 4 vaccines on me. Kept referencing CDC guidelines &amp; I wasn’t having it, NO to all! I thought by this time it would’ve gotten better, it’s worse. I’m sure the hysteria and overkill is pushed by this sham admin, so exams &amp; testing on hold.🤬",anti-mitigation,anti-mitigation,anti-mitigation,anti-mitigation
im not getting the #covidvaccine because of antivaxers or conspiracy theories. Its because i wont be a guinea… https://t.co/X9HdKwFBm9,anti-mitigation,anti-mitigation,anti-mitigation,anti-mitigation
"That’s my understanding of the differences in guidance. US is further along in the public vaccination process, so guidelines from CDC are going to seem “riskier” or more liberal than from the WHO, because the general population has a lower overall risk because of immunizations.",unclear,pro-mitigation,unclear,pro-mitigation
"a vaccine seems to be ESSENTIAL if we are to start travelling again...,with ANY confidence...,because fear of the v… https://t.co/AlGCydjOVq",pro-mitigation,pro-mitigation,unclear,pro-mitigation
How about following the CDC guidelines on community spread?  Why did these get thrown out last school year?  https://t.co/A6PdH1yZD5,unclear,unclear,anti-mitigation,unclear
so after a year of “follow CDC guidelines” now we are saying …don’t follow CDC guidelines??? Now because you personally disagree with the CDC but have no factual evidence based on science to support going against them …   https://t.co/GDbgARBzKj,unclear,unclear,pro-mitigation,pro-mitigation
Pfizer/BioNTech say #COVID_19 jab on track for approval by year-end https://t.co/BdNQLpDlAb via https://t.co/B0JOpQwlI2,unclear,unclear,unclear,pro-mitigation
"Putin ryt now..
#CoronavirusVaccine 
#RussianVaccine 
#CovidVaccine https://t.co/630MB3ZJqI",unclear,unclear,unclear,unclear
#BREAKING: Fully vaccinated teachers and students don't need to wear masks inside school buildings. Read the CDC's updated guidelines here:  https://t.co/aSCOzujtQ5,pro-mitigation,unclear,unclear,pro-mitigation
I don’t think the GOP lost in Texas and if a large majority of Texans opposed the bill I don’t think the GOP would have majority power there.,unclear,unclear,unclear,unclear
"At least 31,000 volunteers from more than 120 nationalities have taken part in #UAE's first Phase III trials of an… https://t.co/IOt9lS7Kyo",unclear,pro-mitigation,unclear,unclear
"Russia wants to partner india in COVID-19 vaccine production

#Corona 
#CoronaVaccine 
#COVID19 
#Russia 
#SputnikV… https://t.co/McCKIZrY2L",unclear,unclear,unclear,unclear
Russia announces they have a vaccine. #CovidVaccine #RussianVaccine #Vaccine #TrumpRussia #TrumpPutin #PutinsPuppet… https://t.co/SEH3GaRoy7,unclear,unclear,unclear,unclear
The CDC’s guidelines We’re guidelines not laws but of course dumb politicians individual states ran with it well I’m not sitting by and doing nothing I’m fighting back and doctors need to do the same and there’s still time to get your voice heard,anti-mitigation,unclear,anti-mitigation,anti-mitigation
"Don’t say that you weren’t warned.
#ThursdayThoughts #qanon #QAnon2020 #TikTok #China #RuleBritannia #vaccine… https://t.co/o8XUR8JKsB",unclear,unclear,unclear,unclear
"Till date, the nation has announced almost 24,000 instances of the infection, of which, upwards of 438 individuals… https://t.co/XSXCnls30z",unclear,unclear,unclear,unclear
"""We need to rapidly scale up our clinical trials, manufacturing, licensing and regulation capacity"" 

#WHO… https://t.co/bOp6hjGFBJ",unclear,pro-mitigation,pro-mitigation,unclear
"The reason being is the soon to be dropped, and even more horrible, expanded CDC guidelines, imho.",anti-mitigation,unclear,anti-mitigation,anti-mitigation
Cdc states you no longer need a mask if vaccinated. I get allot of people aren’t but if you are according to the data and scientists you no longer need to mask up. If it helps you feel safer then by all means continue but its no longer a requirement set forth by cdc guidelines,pro-mitigation,unclear,unclear,pro-mitigation
😳 wow my life on the pasion of the public and in accordinancd with cdc guidelines we have a title.,unclear,unclear,unclear,pro-mitigation
Planning to reopen your building or increase building usage following reduced operation? Be sure to follow CDC guidelines to ensure the water quality is safe. Visit  https://t.co/gXZIQQKSQd to learn more or contact us at dwmconnect https://t.co/7lKESVvAjM,pro-mitigation,unclear,unclear,pro-mitigation
"Rochelle Walensky is relaxing guidelines so she can act like William Wallace in Braveheart, yelling ""FREEDOM!!"" Now, more kids are getting sick, and the CDC barely says a word about the risk for those of us who are vaccinated but immunocompromised. The needs to clean house.",anti-mitigation,anti-mitigation,anti-mitigation,anti-mitigation
"As an RN, I have always been an advocate for VACCINES but for the first time in my life, I can boldly say that I wi… https://t.co/DCCmzzQ6Ad",anti-mitigation,pro-mitigation,pro-mitigation,unclear
"This quarantine has been immensely frustrating in many ways, but by far the most frustrating is the lack of communication on when I am able to end self isolating. DC's government website has multiple contradictory guidelines. Those are seperate &amp; different than the CDC, or OAP.",anti-mitigation,anti-mitigation,unclear,anti-mitigation
"What country you prefer PH's vaccine should come from? Why? 
(asa ang inyuha PILIon na ug Ngano?)

#CovidVaccine… https://t.co/NKnd9PMQeO",unclear,unclear,unclear,pro-mitigation
"Looks like we’re within weeks of reversing the guidelines and that almost every doctor and epidemiologists was saying that the CDC guidelines were prematurely issued in May, they were correct and they’ll further damage their credibility.",anti-mitigation,unclear,anti-mitigation,anti-mitigation
I love them saying to “go beyond CDC” instead of what they are doing which is “going against CDC” guidelines 🤣,anti-mitigation,unclear,pro-mitigation,pro-mitigation
I'm supposed to take you serious ?  Virtue Signal Checklist  woke avatar  ✅ abused animal in mask counter to CDC guidelines ✅  https://t.co/Fv0wAh4Pme  https://t.co/5hAg8IPN09,unclear,unclear,unclear,anti-mitigation
State officials have said they will follow CDC guidelines as Washington prepares to reopen.  https://t.co/Rvz91AeJoB,unclear,unclear,unclear,pro-mitigation
"-Russia has annouced first #CovidVaccine 
-Putin daughter inoculated
-says rigorous safety data review needed… https://t.co/NwnA9q44Ee",unclear,pro-mitigation,unclear,unclear
lol the cdc shouldve never stopped those guidelines but hey wat do i know lol,pro-mitigation,unclear,anti-mitigation,anti-mitigation
Fox Kerry spotted violating CDC guidelines at airport — and it's not the first time he is almost as ugly as he is hypocritical,pro-mitigation,anti-mitigation,pro-mitigation,pro-mitigation
"Every graph I've seen from CDC, NIH, HHS, &amp; NIDA shows that they were tracking Fentanyl/Carfentanyl OD deaths long before the 2016 CDC Guidelines were put out. Frieden/PROP KNOWINGLY screwed us.",unclear,unclear,anti-mitigation,anti-mitigation
"Clinical research #ageism is real as exemplified by exclusion of older adults from all sorts of trials. 

In… https://t.co/wGCLr7MnBg",unclear,unclear,unclear,unclear
I follow CDC and local guidelines and happily wear a mask when required.  Because I believe in science.,pro-mitigation,pro-mitigation,pro-mitigation,pro-mitigation
"With Limited COVID-19 Vaccine Doses, Who Would Get Them First? https://t.co/ngDpflpYoB via 
--
#Vaxnews… https://t.co/6sQIOzCci8",unclear,unclear,unclear,unclear
"#Pune  First 100 vaccine volunteers enter key week. ""CoviShield"" is being Jointly Developed by Oxford University &amp;… https://t.co/6Qli3DKSwV",unclear,unclear,unclear,pro-mitigation
"#COVIDVaccine 

Very large spread in vaccine effeciacy (flu is modest to measles being v. effective).  Depending on… https://t.co/s2DA4v2y6C",unclear,pro-mitigation,unclear,pro-mitigation
"Then he can wear a mask the entire time he's in an indoor stadium, locker room, press room, etc. That's the CDC Guidelines, and the &amp; should ensure he adheres to those guidelines the entire time for the safety of those unfortunate enough to be around him.",pro-mitigation,pro-mitigation,pro-mitigation,pro-mitigation
"Amazing . They make a turn towards the factual truth , BUT they justify why people are confused is because CDC guidelines changed overtime . SMH 🤦🏼‍♂️",unclear,unclear,anti-mitigation,pro-mitigation
The world's largest #vaccine maker warns it'll take until 2024 for everyone across the globe to get vaccinated for… https://t.co/KcP744BbJi,unclear,unclear,unclear,anti-mitigation
"Some (?) in 'twitterland' have seen good effects of mask wearing eg. lack of flu season; those with immune/cancers etc. So, er usual - some people are governed by the CDC and adapt those guidelines (in a positive way) to their own personal circumstances. Agree.",pro-mitigation,pro-mitigation,pro-mitigation,pro-mitigation
"Draft landscape of list of Approved vaccines by WHO 

AstraZeneca, Moderna, Pfizer are on Phase 3 of trials 

India… https://t.co/yt63917YW7",unclear,unclear,unclear,unclear
"What do you want your facemask to do?
#COVID19 #coronavirus #facemasks #CovidVaccine",unclear,unclear,unclear,anti-mitigation
"Developing a COVID-19 vaccine is hard. Getting people to use it will be, too. via #COVID-19 #Coronavirus… https://t.co/oMFNIf0WNp",unclear,unclear,unclear,anti-mitigation
"A1: How did I miss this discussion?!?!
Doing my best to continue to advocate for #vaccines on SoMe - esp… https://t.co/2E8dojUGs1",pro-mitigation,pro-mitigation,pro-mitigation,pro-mitigation
"CDC is a general strategy.  But states still do things differently.  Emergency Management is local, regional, state then Fed.  Or in this case Israel.  Decisions are made at the local level for containment regardless of CDC Guidelines.  They are just Guidelines.",unclear,unclear,anti-mitigation,unclear
reporter tries to put words in mouth … trying to make him sound like the arbiter of #CovidVaccine… https://t.co/W3uNQlTUxB,unclear,unclear,pro-mitigation,unclear
"#CovidVaccine 

When will a vaccine be ready for Covid 19 https://t.co/QGzEsrnFLX",unclear,pro-mitigation,unclear,pro-mitigation
Please help the chronic pain patient community as well. The false narrative of opiate epidemic is literally killing us! Illicit drugs and pressed pills causing it not prescribed meds. Pa needs to remove CPP from CDC guidelines. Opiates work well/taken correctly/stored correctly!,unclear,unclear,anti-mitigation,anti-mitigation
"Wait, if Russia is claiming the first #CovidVaccine With just a phase 2 testing doesn’t that mean Oxford and Modern… https://t.co/4dNW1gbXw2",unclear,unclear,unclear,unclear
"Lol, its funny how Trump is using the Covid Vaccine as his momentum to win the re-election. I honestly just hope th… https://t.co/GEaY3RWJTT",unclear,unclear,anti-mitigation,unclear
"CDC guidelines, rules, laws do not apply to Democrats, just like Pelosi, and the rest.",unclear,unclear,anti-mitigation,anti-mitigation
"$jnj #covidvaccine as situation drags on, think we can safely say participant got vaccine, not the placebo.",unclear,pro-mitigation,pro-mitigation,pro-mitigation
DMRegister: A federal appeals court panel sided with the CDC in its legal battle with Florida over COVID-19 guidelines for cruise lines.   https://t.co/dSqA4iWEy9,unclear,unclear,unclear,unclear
"Corona Update in India!
Total Confirmed:2.72M
Active Cases:0.67M
Total Recovered: 2M
Total Deaths:52163
Updated at:… https://t.co/riPtQ9f3Sf",unclear,unclear,unclear,unclear
What's your beef with him anyway. He's not the head of the CDC and that's the agency that sets the guidelines. There are other docs out there too. The say a lot worse is ahead.,anti-mitigation,unclear,unclear,anti-mitigation
"#CovidVaccine: The tragedy of vaccine nationalism - only cooperation can end the pandemic | Foreign Affairs
https://t.co/61Fp3c6qHS",unclear,pro-mitigation,pro-mitigation,pro-mitigation
The CDC changed its testing guidelines long before the baseball post-season - i.e. the CDC advises against testing vaccinated persons. And yet the NCAA is still using 2020 protocols. Why? 1/,unclear,anti-mitigation,pro-mitigation,pro-mitigation
Missouri Gov. Mike Parson calls the CDC’s decision “totally ridiculous” but an agency official says guidelines limit size of incentives.  https://t.co/N7wpxEMEAn,unclear,anti-mitigation,unclear,anti-mitigation
"Healthcare workers likely to be first in line for coronavirus vaccination. https://t.co/ck3kDWfsPf

#COVID #COVID19… https://t.co/dxbq39Z1hA",unclear,unclear,unclear,pro-mitigation
"Throughout the pandemic, Nemacolin has exceeded CDC and commonwealth guidelines and mandates for the hospitality industry. At this time, anyone at Nemacolin is welcome to wear a mask if they desire, and you'll still see many of our spa associates doing so.",unclear,pro-mitigation,pro-mitigation,pro-mitigation
What is it like to be a developer in these rapidly evolving modern time? Come by the first in-person #dotnet #stl #meetup tonight in quite awhile! (observing CDC and state guidelines for public gatherings)  https://t.co/2AumuK2uzn,unclear,unclear,unclear,unclear
"With growing uncertainty over work, wages, and wellbeing in the wake of the global pandemic Novel Coronavirus COVID… https://t.co/0R49YueOnD",unclear,unclear,unclear,unclear
"This article from the nbaa, not the CDC, is from February 7th... guidelines have been updated quite a bit since then regarding vaccinated travelers... but good try with your misleading post there...",pro-mitigation,unclear,pro-mitigation,unclear
"COVID-19 warriors will first ones to get vaccine dose, announces MoS Health #covid19 #coronavirus #covidvaccine… https://t.co/Uv5fhPI72b",unclear,pro-mitigation,unclear,pro-mitigation
#Nurses are going to have to get a lot more vocal about #VaccineSafety this season — it’s estimated that 1/3 of Ame… https://t.co/WTnYvcNc1b,unclear,unclear,unclear,unclear
 you also need burnol #BurnolForAirasia or Covid vaccine #CovidVaccine #COVID,unclear,pro-mitigation,unclear,pro-mitigation
"#covidvaccine phase 1 
👇👇👇 coming soon. Big  brother is healthy alive and well. 🧐👀👀👀

https://t.co/wgvvTeRTab",unclear,pro-mitigation,unclear,unclear
"Namely, when the CDC released their updated guidelines for summer camps for 2021, the CDC had said that masks were not necessary outside ...   https://t.co/4gGsTipYkm",unclear,anti-mitigation,unclear,pro-mitigation
